HospitalName,Speciality,HospitalImage,Location,Description
"Wockhardt Hospital, Mumbai","Multi-Superspeciality","https://www.indicure.com/assets/img/2022/02/Wockhardt-Hospitals-360x223.jpg.webp","Mumbai","Wockhardt Hospitals is the hospital branch of the leading Wockhardt pharmaceutical company in India. The company is more than 4 decades old and is present in more than 20 countries around the globe. Wockhardt has 9 facilities in India in Mumbai, Nagpur, Rajkot, Nasik, and Surat.Wockhardt Hospital, South Mumbai is one of the most famous and advanced facilities of the Wockhardt group. Accredited by JCI, NABH and NABL, Wockhardt hospital, South Mumbai is a tertiary care multi super-specialty hospital offering state-of-the-art facilities and international standards of care.In pursuance of its vision to establish state-of-the-art medical facilities in India along with a high degree of clinical excellence, the hospital has entered into strategic alliances with Partners Medical International, USA, whereby Wockhardt has access to Harvard's expertise and experience in the fields of surgery and other Medicare services, making it one of the best hospitals in Mumbai."
"Apollo Hospital, Navi Mumbai","Multi-Superspeciality","https://www.indicure.com/assets/img/2022/02/Apollo-Hospitals-Mumbai.jpg.webp","Mumbai","Apollo Hospital, Navi Mumbai is the newest addition to the Apollo group having started its operations in 2016. It is a 500 bedded super-specialty tertiary care facility catering to Navi Mumbai and various suburbs of Mumbai.It is one of the most advanced multi-specialty tertiary care hospitals in the city, providing a wide range of treatments all under one roof. This is the Apollo Group's 66th hospital, which has been accredited by the National Accreditation Board for Hospitals (NABH) and Joint Commission International (JCI). It is equipped with cutting-edge technology and meets international standards making it one of the best hospital in Mumbai."
"Fortis Hospital, Mulund, Mumbai","Multi-Superspeciality","https://www.indicure.com/assets/img/2022/02/Fortis-Hospital-Mulund-Mumbai.jpg.webp","Mumbai","Fortis Hospital, Mulund is a 300 bedded multispeciality tertiary care facility situated in the centre of the city, offering a range of clinical, diagnostic, and surgical services.The hospital began operations in 2002 and since then has achieved various milestones. The hospital is a JCI and NABH accredited facility and among very few hospitals to have NABH accreditation for Blood bank and NABL for Pathology Laboratory."
"Gleneagles Global Hospital, Mumbai","Multi-Superspeciality","https://www.indicure.com/assets/img/2022/02/Global-Hospitals-Mumbai.jpg.webp","Mumbai","Gleneagles Global hospital in Mumbai, which is the latest addition to the geographical footprints of the Gleneagles group in India, offers comprehensive cardiac care to its patients.With a track record of nearly 4000 cardiac procedures, the cardiac centre of excellence proudly stands as one of India's premier cardiac centres, specializing in cardiology and cardiovascular thoracic surgeries. Whether it is minimally invasive techniques or the most intricate heart transplant surgeries, the hospital possesses the necessary infrastructure and proficiency to handle them all.Equipped with state-of-the-art surgical suites, post-surgery intensive care units, and advanced diagnostic facilities, the hospital has established itself as a top destination for heart health in Mumbai."
"Jaslok Hospital, Mumbai","Multi-Superspeciality","https://www.indicure.com/assets/img/2022/02/Jaslok-Hospital-Mumbai.jpg.webp","Mumbai","Jaslok Hospital and Research Centre is one of the oldest tertiary care, multi-specialty Trust hospitals in the country. The hospital was conceptualized by Seth Lokoomal Chanrai, who came from a family of philanthropists with businesses in various countries. The facility has taken its name Jaslok, from the names of Seth Lokoomal & his wife Smt. Jasotibai. It was inaugurated on 6th July 1973 by the erstwhile Prime Minister Mrs. Indira Gandhi.Jaslok is a state-of-the-art, multi-specialty tertiary care private hospital with around 370 beds and 75 beds in intensive care. The hospital has a few of the most renowned doctors and surgeons in India on its panel. With a team of 300 specialists and 150 well-trained resident doctors on its panel, the hospital has an army of highly skilled manpower making it one of the most renowned, trusted and best hospital in Mumbai."
"Nanavati Max Super Speciality Hospital","Multi-Superspeciality","https://www.indicure.com/assets/img/best-hospitals/Mumbai/Nanavati-Super-Speciality-Hospital,-Mumbai.jpg.webp","Mumbai","The Dr. Balabhai Nanavati Hospital in Mumbai, which was blessed by Mahatma Gandhi and inaugurated in 1950 by India's first Prime Minister Jawaharlal Nehru, has been renamed Nanavati Max Super Speciality Hospital. For over 70 years, Nanavati Max Super Speciality Hospital has been at the forefront of healthcare. The 350-bed institution, which has 55 specialty departments, now provides a wide range of services in almost every discipline of modern medicine and health care."
"Fortis Hiranandani Hospital, Vashi, Mumbai","Multi-Superspeciality","https://www.indicure.com/assets/img/best-hospitals/Mumbai/Fortis-Hiranandani-Hospital,-Vashi.jpg.webp","Mumbai","Fortis Hiranandani Hospital, which was opened in 2007, is a multi-specialty hospital that provides a wide range of innovative medical services.The hospital has been awarded the President of India's National Energy Conservation Award. The SRL-NABL accredited pathology laboratory at Hiranandani Hospital is the only one in the city.It offers a wide range of medical services, including orthopedics, cardiology, neurology, pediatrics, urology, nephrology, ENT, and obstetrics and gynecology."
"Saifee Hospital, Mumbai","Multi-Superspeciality","https://www.indicure.com/assets/img/best-hospitals/Mumbai/Saifee-Hospital,-Mumbai.jpg.webp","Mumbai","Saifee Hospital was founded in 2005 and is ISO and NABL accredited. There was an old Saifee Hospital that has been in operation since 1948. In 2001, work on a new hospital on the site of an old one began. The new hospital was inaugurated in June 2005 in the presence of Dr. Manmohan Singh, India's former Prime Minister.This hospital was named after Syedna Mohammad Burhanuddin's father, Syedna Taher Saifuddin.This multi-specialty hospital offers a wide range of services, from easy Day-care treatments to acute care emergency medicine and sophisticated Cardiac surgery. It has India's first LASIK (advanced laser eye surgery) suite."
"HCG Cancer Hospital, Mumbai","Oncology","https://www.indicure.com/assets/img/best-hospitals/Mumbai/HCG-Cancer-Centre,-Mumbai.jpg.webp","Mumbai","HCG Cancer Centre is the first dedicated cancer hospital in Mumbai giving a top-quality treatment by using worldwide advancements. In the state of Maharashtra, it is the first centre to launch the Elekta Versa HD Radiation Machine. This machine has agility, which allows for a high-speed, high-precision beam to precisely target the tumor. The hospital is NABH accredited.HCG Centre, Mumbai is the first hospital in Western India to use CyberKnife, the world's first whole-body robotic radiosurgery technology. The Radixact TomoTherapy Radiation Therapy machine was also introduced in Mumbai.A dedicated hemato-oncology unit with a Bone Marrow Transplant program is available at the hospital. Thyroid and prostate cancers are treated with high-dose isotope therapies at the department. The hospital's Nuclear medicine section contains modern PET Scan machines amongst other things making it one of the best hospitals in Mumbai."
"Asian Heart Institute, Mumbai","Cardiology & Cardiac Surgery","https://www.indicure.com/assets/img/best-hospitals/Mumbai/Asian-Heart-Institute,-Mumbai.jpg.webp","Mumbai","Established in 2002, the Asian Heart Institute (AHI) stands as one of India's premier cardiac care institutions, delivering top-tier cardiovascular healthcare. With over 415,000 patients having received treatment, the hospital has an impressive track record of conducting 26,500 heart surgeries and 50,000 angiograms.AHI is internationally renowned for its exceptional expertise in intricate heart surgeries, boasting an unparalleled success rate of 99.83% in cardiac surgeries, unmatched globally. This makes AHI one of the best heart hospitals in India.The hospital is also involved in research and educational activities related to cardiovascular diseases. It conducts training programs and workshops for healthcare professionals to enhance their knowledge and skills in cardiac care."
"Neurogen Brain & Spine Institute, Mumbai","Stem Cell Treatment & Neuro Rehabilitation","https://www.indicure.com/assets/img/best-hospitals/Mumbai/Neurogen-Brain-and-Spine-Institute,-Mumbai.jpg.webp","Mumbai","NeuroGen Brain & Spine Institute is well-known for offering treatment options for incurable neurological disorders by using ground breaking regenerative medicine, all-encompassing holistic neurorehabilitation, and medical intervention. Being considered as one of the best hospitals in Mumbai, NeuroGen's distinctive feature lies in its seamless integration of the latest advancement of stem cell/ bone marrow-derived cells, with well-established and proven rehabilitation methods.The NeuroGen Brain and Spine Institute has a cutting-edge lab. To carry out the processing, it is adequately equipped with a variety of sophisticated instruments. They have a staff of specialist neuropathologists that perform this surgery in a thoroughly sterile environment.Many honors have been bestowed upon the centre, including:"
"Apollo Spectra Hospital, Chembur, Mumbai","Multi-Speciality","https://www.indicure.com/assets/img/best-hospitals/Mumbai/Apollo-Spectra-Hospital,-Chembur.jpg.webp","Mumbai","Apollo Spectra is a state-of-the-art specialty hospital. It is dedicated to bringing together excellent medical services and the finest healthcare management techniques. Bariatric Surgery, ENT specialties including Thyroid Surgery, General & Laparoscopic Surgery, Orthopedics & Spine surgery, Urology, and Varicose Veins, to name a few, are among the surgical specialties offered at the hospital.The hospital has 4 ultra-modern modular OTs, a state-of-the-art rehabilitation centre, an in-house pharmacy, and a waiting lounge for in-patients' families, to mention a few amenities. Over 125 healthcare experts, including 90 specialty specialists, are dedicated to setting a new standard in healthcare services with the single-minded goal of providing uncomplicated quality healthcare.The best part is the personalized services and care one can expect at the hospital, dedicated only to clean and elective surgeries, making it one of the most unique and best hospitals in Mumbai."
"MGM Hospital, Navi Mumbai","Multi-Superspeciality","https://www.indicure.com/assets/img/2022/02/mgm-hospital-mumbai.jpg.webp","Mumbai","MGM Hospital is a landmark hospital in Mumbai caring for patients since 1982. Mahatma Gandhi Mission Trust is the parent body of the hospital, which has been providing state of the art healthcare facilities to patients across the world since its inception.It is a chain of hospitals all across India known for its patient centric care, excellent medical practices and state of the art technology.The hospital is NABH, ISO 9001:2015 certified organization. MGM hospital is a technologically advanced institution designed to international standards and the most stringent criteria in infrastructure, medical care and patient friendly facilities. This is because every element that comprises the hospital's making- from the premises, to the processes, to its professionals, contribute to overriding principles- Respect for patients and their families."
"Bharti Vidyapeeth Medicover Hospital, Navi Mumbai","Multi-Superspeciality","https://www.indicure.com/assets/img/2022/02/bharti-medicover-hospital.jpg.webp","Navi Mumbai","Bharati Vidyapeeth Medicover Hospital is one of the top hospitals in Navi Mumbai, offering International standards for medical management and other healthcare services to patients.Medicover hospitals provide a cutting-edge healthcare infrastructure and are furnished with eight advanced laminar flow operating theatres. These theatres feature world-class medical apparatus such as Neuro Microscopes, Laparoscopic Surgery devices, and MISS technology.Equipped with the most advanced diagnostic amenities, the hospital also offers cutting-edge diagnostic methodologies. These include a Cath Lab featuring IVUS, OCT, and FFR technologies, round-the-clock state-of-the-art radiology services encompassing CT Scans, 3T MRI, USG, Mammography, bone mineral density (BMD) assessments, Digital X-Ray, sophisticated USG-guided Gastroscopes supported by advanced endoscopes, 16-channel Manometry, as well as Capsule Endoscopy boasting 11 Cameras."
"Zynova Shalby Multi-specialty Hospital, Mumbai","Multi-Superspeciality","https://www.indicure.com/assets/img/2022/02/zynova.jpg.webp","Mumbai","Zynova Shalby Multi-Speciality Hospital is a 100-bedded medical facility that holds NABH Pre Accreditation. Originally founded as Zynova Heartcare Hospitals in 2007, the hospital underwent a co-branding venture with the Shalby group in 2021. Shalby, known for its network of multi-specialty hospitals spread across India, boasts an aggregate bed capacity exceeding 2000.The brainchild of Dr. Vikram Shah, Shalby's reputation as a leading multispecialty tertiary hospital chain within the Indian healthcare sector has been firmly established. Zynova Shalby Hospital's commitment to excellence is evident in its attainment of the esteemed NABH (National Accreditation Board of Hospitals & Healthcare Providers) certification. Moreover, the hospital stands as an NABL-recognized institution, offering a comprehensive array of laboratory testing services for diverse disease conditions.The hospital's workforce comprises CQI-certified professionals who tirelessly operate around the clock, ensuring the delivery of high-quality healthcare services to both patients and corporate entities adding it to the list of best hospitals in Mumbai."
"Zen Multi-specialty Hospital, Chembur","Multi-Superspeciality","https://www.indicure.com/assets/img/2022/02/zen.jpg.webp","Mumbai","Zen Multi Specialty Hospital is well equipped with highly trained personnel & state-of-the-art modern facilities. The hospital provides services such as orthopedics, ENT Centre, cardiology, bariatric, plastic, oncology, neurology, nephrology, general surgery, gynecology and many more.Zen Hospital's Center for Minimally Invasive and 3D Laparoscopic Surgery stands out as a rare entity in India, equipped with both 3D laparoscopic surgery and 4K+ Laparoscopy capabilities allowing it to stand among some of the best hospitals in MumbaiThe centre's primary focus is prioritizing the needs of patients. It consistently showcases exceptional results through a combination of expert surgeons, empathetic bedside attention, and the provision of cutting-edge technology. Each year, the accomplished surgical team at Zen Hospital undertakes more than a thousand cases of minimally invasive and 3D laparoscopic surgeries, underscoring their commitment to advanced healthcare."
"Sujay Hospital, Juhu","Multi-Superspeciality","https://www.indicure.com/assets/img/2022/02/sujay-hospital.jpg.webp","Mumbai","Sujay Hospital, located in the Juhu area of Mumbai, offers multiple medical specialties. It holds the prestigious NABH Certification. The hospital began its journey in April 2005, and over the course of the last 15 years, has successfully treated nearly 50,000 patients, ensuring their utmost satisfaction.The hospital is known for housing best surgeons and most experienced Physicians. By combining excellent care with a state-of-the-art facility, the hospital strives to provide quality health care.The hospital is a 50 bedded facility with 8 ICUs."
"Hinduja Healthcare Surgical, Khar","Multi-Superspeciality","https://www.indicure.com/assets/img/best-hospitals/Mumbai/P.D-Hinduja-Hospital-_-Medical-Research-Centre,-Mumbai.jpg.webp","Mumbai","Hinduja Healthcare Surgical keeps a healthy nurse-to-patient ratio to ensure that patients receive individualized treatment. Resident doctors and teams can handle all types of high-risk patients undergoing routine general surgical procedures and aesthetic operations to difficult joint replacements, thanks to state-of-the-art intelligent facilities, cutting-edge technology, and equipment. Over 230 consulting doctors from various disciplines give tailored care in a relaxing environment, assuring the best possible outcome for patients."
"Dr. LH Hiranandani Hospital, Powai, Mumbai","Multi-Superspeciality","https://www.indicure.com/assets/img/2022/02/Dr.-L-H-Hiranandani-Hospital-Mumbai.jpg.webp","Mumbai","Dr. L H Hiranandani hospital was founded in honor of the legend, Padma Bhushan Dr. Hiranandani, and came into existence in February 2004. Within 3 years, viz 2007, it became the first hospital in Western India to receive NABH accreditation, which only eight hospitals in India had received then.The hospital offers all medical and diagnostic facilities under one roof and is counted among the best hospitals in Mumbai. Not only accreditation, but the hospital also has the rare honor to receive the IMC Ramkrishna Bajaj National Quality Award trophy, for excellence in healthcare in 2008. In 2009, Hiranandani hospital received the coveted International Asia Pacific Quality Award (The Malcolm Baldridge Award) as it is known outside the United States."
"Kokilaben Dhirubhai Ambani Hospital, Mumbai","Multi-Superspeciality","https://www.indicure.com/assets/img/2022/02/Kokilaben-Dhirubhai-Ambani-Hospital-Mumbai.jpg.webp","Mumbai","Kokilaben Dhirubhai Ambani Hospital stands as one of India's most cutting-edge and contemporary medical facilities. Situated in the largest suburb of Mumbai, it is a state-of-the-art tertiary care multi-specialty hospital.Cardiology and Cardiac care are one of the hospital's major specialties. The cardiac centre of excellence offers a comprehensive program that covers the full spectrum of heart disease management, spanning from new-borns to adults. This program encompasses prevention, diagnosis, treatment, and rehabilitation services.This best heart hospital in India is backed by accomplished experts who have performed more than 1700 Coronary Angioplasties and 6200 Cardiac Surgeries."
"Namah Hospital, Mumbai","Multi-Speciality","https://www.indicure.com/assets/img/2022/02/NAMAHA-Healthcare-Mumbai.jpg.webp","Mumbai","Namah Hospital is a specialized hospital that started to provide services to only women. Now serving both genders, the hospital has created a unique name in the healthcare sector owing to the personalized care and services it offers to its patients. Located in the famous suburb of Mumbai, the hospital offers state-of-the-art facilities and best-in-class care to patients.Namah Healthcare is a joint venture of Shree Naman Group and the Kapadia family who have experience in women's healthcare for over 7 decades. The hospital is well known for its short-stay surgical procedures and personalized services."
"Sir HN Reliance Hospital, Mumbai","Multi-Superspeciality","https://www.indicure.com/assets/img/best-hospitals/Mumbai/Sir-HN-Reliance-Foundation-Hospital,-Mumbai.jpg.webp","Mumbai","Sir HN Reliance Foundation Hospital was founded in 1925 and is Mumbai's largest LEED Gold-rated Green Hospital. It is Mumbai's first hospital to offer self-contained rooms, with an area of 800,000 square feet (showers, toilets and rest areas for relatives). The hospital features a whole level dedicated to in-patient beds that are free or heavily subsidized.The hospital adheres to AIA design standards, NFPA medical gas standards, ASHARE HVAC requirements, AERB Radiation and Nuclear Medicine standards, and Drug Controller of India blood bank standards."
"Fortis S L Raheja Hospital, Mumbai","Multi-Superspeciality","https://www.indicure.com/assets/img/best-hospitals/Mumbai/S.-L.-Raheja-Hospital,-Mumbai-5.jpg.webp","Mumbai","S. L. Raheja Hospital, Mumbai, was founded in 1981 and is a super specialty hospital in Mahim's suburbs. It is known for providing world-class care in a variety of specialties, including neurology, cardiology, orthopedics, spine, oncology, and minimally invasive surgery.It is one of the few institutions in Mumbai to offer specialized hyperbaric oxygen therapy for diabetic patients, and it is NABH and NABL accredited. Oncology and diabetes are two of the hospital's specialties. The medical and surgical oncologists are represented by eight and nineteen experts respectively. There are 11 medical and 3 surgical endocrinologists on staff.The operating rooms and catheterization labs are outfitted with cutting-edge technology that meets worldwide standards making it one of the best hospitals in Mumbai."
"Currae Specialty Hospital, High Street, Thane","Multispecialty","https://www.indicure.com/assets/img/best-hospitals/Mumbai/Currae-Hospital,-Mumbai.jpg.webp","Mumbai","Currae hospitals are designed and built to make corporate healthcare services more affordable, friendly, and hassle-free. Currae offers personalized attention to every patient and that is the most unique feature about the hospital. And that explains the logo and the punchline of the hospital - 'Hassle-Free Healthcare'.Currae hospitals have the latest medical technology and a few of the best doctors in India on their panel, to provide best-in-class services to the patients. Currae Hospitals are counted among the best hospitals in Mumbai for short stay surgical procedures such as Gynecology, Plastic surgery, Urology, IVF, and Eye care."
"Apollo Spectra Hospital, Tardeo, Mumbai","Multi-Speciality","https://www.indicure.com/assets/img/best-hospitals/Mumbai/Apollo-Spectra-Hospital,-Mumbai.jpg.webp","Mumbai","Apollo Spectra Hospital has a capacity of 30 beds and offers world-class medical care.ENT, Bariatric Surgery, Urology, Orthopedics and Spine, General and Laparoscopic Surgery, and Varicose Veins are among the surgical specialties offered at the hospital. The hospital has a total area of 15000 square feet, provides personalized services and best possible outcomes for patients."
"Cloud Nine Hospital, Mumbai","Gynecology & Pediatrics","https://www.indicure.com/assets/img/2022/02/Cloudline-Hospital-Mumbai.jpg.webp","Mumbai","The Cloud Nine Hospital specializes in IVF, Gynecology and Pediatrics. The clinic has 2 branches in Mumbai- Malad & Vashi. The hospital started its services in 2015 in Malad as a fertility hospital with an emphasis on assisting patients throughout the full pregnancy process, from conception to delivery and child care.Other than Assisted Reproductive Technology (ART), the hospital provides services in gynecology, pediatrics, physiotherapy, nutrition and dietetics, stem cell banking, acute care, cosmetology, neonatal care, breastfeeding assistance, and other related services.Video consultation, home vaccination, sample collection from home, home delivery of medications, online consultation, flu shots at home, and online consultation for breastfeeding and mental health are among the additional options available. It is a leading supplier of prenatal physical therapy."
