HospitalName,Speciality,HospitalImage,Location,Description
"Wockhardt Hospital, Mumbai","Multi-Superspeciality","https://www.indicure.com/assets/img/2022/02/Wockhardt-Hospitals-360x223.jpg.webp","Mumbai","Wockhardt Hospitals is the hospital branch of the leading Wockhardt pharmaceutical company in India. The company is more than 4 decades old and is present in more than 20 countries around the globe. Wockhardt has 9 facilities in India in Mumbai, Nagpur, Rajkot, Nasik, and Surat.Wockhardt Hospital, South Mumbai is one of the most famous and advanced facilities of the Wockhardt group. Accredited by JCI, NABH and NABL, Wockhardt hospital, South Mumbai is a tertiary care multi super-specialty hospital offering state-of-the-art facilities and international standards of care.In pursuance of its vision to establish state-of-the-art medical facilities in India along with a high degree of clinical excellence, the hospital has entered into strategic alliances with Partners Medical International, USA, whereby Wockhardt has access to Harvard's expertise and experience in the fields of surgery and other Medicare services, making it one of the best hospitals in Mumbai."
"Apollo Hospital, Navi Mumbai","Multi-Superspeciality","https://www.indicure.com/assets/img/2022/02/Apollo-Hospitals-Mumbai.jpg.webp","Mumbai","Apollo Hospital, Navi Mumbai is the newest addition to the Apollo group having started its operations in 2016. It is a 500 bedded super-specialty tertiary care facility catering to Navi Mumbai and various suburbs of Mumbai.It is one of the most advanced multi-specialty tertiary care hospitals in the city, providing a wide range of treatments all under one roof. This is the Apollo Group's 66th hospital, which has been accredited by the National Accreditation Board for Hospitals (NABH) and Joint Commission International (JCI). It is equipped with cutting-edge technology and meets international standards making it one of the best hospital in Mumbai."
"Fortis Hospital, Mulund, Mumbai","Multi-Superspeciality","https://www.indicure.com/assets/img/2022/02/Fortis-Hospital-Mulund-Mumbai.jpg.webp","Mumbai","Fortis Hospital, Mulund is a 300 bedded multispeciality tertiary care facility situated in the centre of the city, offering a range of clinical, diagnostic, and surgical services.The hospital began operations in 2002 and since then has achieved various milestones. The hospital is a JCI and NABH accredited facility and among very few hospitals to have NABH accreditation for Blood bank and NABL for Pathology Laboratory."
"Indraprastha Apollo Hospital","Multi-Superspeciality","https://www.indicure.com/assets/img/2022/01/Indraprastha-Apollo-Hospital-360x223.jpg.webp","New Delhi","Indraprastha Apollo, New Delhi is a multi-specialty tertiary-care facility and is one of the most sought-after healthcare destinations in Asia. Indraprastha Apollo was the first hospital in India to be accredited by JCI. Spread over 15 acres, Apollo Delhi is one of the most modern and state-of-the-art facilities situated in the posh South Delhi. Considered to be the flagship hospital of Apollo group, Indraprastha Apollo Hospital is one of the important landmarks not only in Delhi but on the world map because of its popularity among medical tourists.Spread over 15 acres, Indraprastha Apollo has a built-up area of over 600,000 square feet. The hospital offers more than 50 specialties under one roof and is very well equipped to handle even the most complicated surgical procedures like Whipple surgery, or even Pancreas transplant surgery or a Lung transplant."
"Manipal Hospital, Palam Vihar, Gurgaon","Multi-Superspeciality","https://www.indicure.com/assets/img/2022/02/Manipal-Hospital-Formerly-Columbia-Asia-Palam-Vihar-Gurgaon.jpg.webp","Gurgaon","Manipal Hospital, formerly Columbia Asia, Palam Vihar is a 90 bedded, NABH accredited multi-specialty facility located in upmarket Palam Vihar in NCR Delhi, located in close vicinity to the airport. The hospital has an international level infrastructure and adheres to globally benchmarked medical, nursing, and operating practices. It is one of Gurgaon's most popular healthcare service providers.Obstetrics & Gynecology, Internal Medicine, General Surgery, Paediatrics, Ophthalmology, Ear, Nose & Throat, Urology, Gastroenterology, Plastic Surgery Orthopaedics, Dermatology, Smoking Session Clinic, Sleep Lab, Cardiology, Neurosurgery & Spine Surgery, Pulmonology are some of the clinical services available at the hospital."
"Artemis Hospital, Gurgaon","Multi-Superspeciality","https://www.indicure.com/assets/img/2022/02/Artemis-Health-Institute-360x223.jpg.webp","Gurgaon","Artemis Health Institute is an initiative by the owners of Apollo Tyres into healthcare. Spread over 9 acres, Artemis is a 300 bedded multi-super specialty tertiary care hospital located at Gurgaon, in the National Capital Region, Delhi. Artemis was the first hospital in Haryana to get NABH accreditation within 3 years of its start-up. The hospital then added another feather in its cap in a few years of its startup- Artemis got the gold standard in healthcare accreditation – JCI, USA accreditation and became the first and only hospital in Gurgaon to be accredited by Joint Commission International (JCI, USA) in 2013.Besides having a robust infrastructure, Artemis hospital offers the most modern techniques for treatment and the most advanced surgical procedures."
"Fortis Memorial Research Institute, Gurgaon","Multi-Superspeciality","https://www.indicure.com/assets/img/2022/01/Fortis-Memorial-Research-Institute-360x223.jpg.webp","Gurgaon","Fortis Memorial Research Institute (FMRI), the flagship hospital of Fortis Healthcare, is a multi-specialty, quaternary care hospital and is counted among not only the best hospitals in New Delhi, but also one of the best hospitals in India and the world.The hospital is located in Gurgaon or NCR (National Capital Region), on the outskirts of Delhi. Besides being a premium referral healthcare facility, it endeavors to be the 'Mecca of Healthcare' for the Asia Pacific and beyond.The hospital is set on a spacious 11 acres campus, with 1000 beds, is equipped with state-of-the-art technology. FMRI is the first to bring the most advanced technology not only in India or Asia, but few are the first to be introduced in the world."
"BLK Max Super Speciality Hospital","Multi Superspeciality","https://www.indicure.com/assets/img/2022/02/BLK-Max-Superspecialty-Hospital.jpg.webp","New Delhi","BL Kapur Memorial Hospital was one of the biggest standalone private hospitals in Delhi, NCR, now taken over by Max Group of hospitals. Established by late Dr. B L Kapur, an eminent Obstetrician, and Gynecologist on invitation by then Prime Minister of India, Mr. Jawahar Lal Nehru. The institute went on to become one of Delhi's premier multi-specialty hospitals. BLK Max Hospital has consistently ranked among the Top 10 Multi Super Speciality Hospitals in India.Accredited by JCI, USA, the institute has 650 beds with dedicated 125 critical care beds and over 150 specialties making it one of the best hospitals in New Delhi and India. Equipped with the most advanced technology, BLK is well renowned for Bone Marrow Transplants and other highly specialized treatments like Heart transplant."
"Fortis La Femme, Vasant Kunj, Delhi","Multi-Speciality","https://www.indicure.com/assets/img/2022/02/Fortis-La-Femme-New-Delhi.jpg.webp","Delhi","Fortis La Femme, founded in 2004, is a multi-specialty hospital that provides care for all periods of a woman's life, including birth, motherhood, menopause, and beyond.The hospital was named the winner of the 'Most Popular Maternity Hospitals' category in Child magazine's Most Popular Awards 2013. More than 11,000 deliveries and 7,500 Gynaecology operations have been performed."
"MGM Hospital, Navi Mumbai","Multi-Superspeciality","https://www.indicure.com/assets/img/2022/02/mgm-hospital-mumbai.jpg.webp","Mumbai","MGM Hospital is a landmark hospital in Mumbai caring for patients since 1982. Mahatma Gandhi Mission Trust is the parent body of the hospital, which has been providing state of the art healthcare facilities to patients across the world since its inception.It is a chain of hospitals all across India known for its patient centric care, excellent medical practices and state of the art technology.The hospital is NABH, ISO 9001:2015 certified organization. MGM hospital is a technologically advanced institution designed to international standards and the most stringent criteria in infrastructure, medical care and patient friendly facilities. This is because every element that comprises the hospital's making- from the premises, to the processes, to its professionals, contribute to overriding principles- Respect for patients and their families."
"Medanta Medicity, Gurgaon","Multi-Superspeciality","https://www.indicure.com/assets/img/2022/01/Medanta-Medicity-360x223.jpg.webp","Gurgaon","Medanta The Medicity is a renowned multi-specialty hospital in Gurgaon, India, known for providing comprehensive cardiac care. Medanta was established by Dr. Naresh Trehan in 2009, a renowned Cardiovascular and Cardiothoracic surgeon, after he returned to India post his long stint in USA.The hospital has received various national and international accreditations, including Joint Commission International from USA, reflecting its commitment to quality and safety standards.The hospital has dedicated cardiac surgery units with advanced operating theatres for a variety of heart surgeries, including coronary artery bypass grafting (CABG), valve repair or replacement, and heart transplant surgery."
"Max Super Speciality Hospital, Saket, New Delhi","Multi-Superspeciality","https://www.indicure.com/assets/img/2022/02/BLK-Max-Superspecialty-Hospital.jpg.webp","New Delhi","Max Super Specialty Hospital in Saket was established in 2006.Max Healthcare was recognized for its efforts to improve customer experience and patient safety at the FICCI Healthcare Excellence Awards and also awarded Express Healthcare Awards for Healthcare Excellence. The hospital has also been awarded Quality Council of India's D L Shah National Award for 'Economics of Quality'.Cardiology, Plastic Surgery, Cancer Care, Orthopaedics, Pediatrics, Neurosurgery, Mental Health and Behavioral Sciences, Endocrinology, ENT, Neurosciences, Eye Care, Internal Medicine, and Minimal Access Surgery are among the specialties.The hospital also performs highly specialized procedures like Robotic Prostate surgery, Minimally Invasive Heart Bypass surgery etc."
"Apollo Spectra Hospital, Karol Bagh","Multi-speciality","https://www.indicure.com/assets/img/2022/02/Apollo-Spectra-Delhi.jpg.webp","New Delhi","With a bed capacity of 16, this cutting-edge speciality hospital is dedicated to bringing together state of the art medical services and personalized care for its patients. Bariatric Surgery, Obstetrics & Gynaecology, ENT, General & Laparoscopic Surgery, Orthopaedics & Spine and Urology are just a handful of the surgical specialties available at the hospital. The hospital has 4 ultra-modern modular OTs, a state-of-the-art rehabilitation centre, an in-house pharmacy, and a waiting lounge for in-patients' families, to mention a few amenities.The hospital also offers Vascular surgery for treatment of varicose veins using Endovascular Laser Treatment, occlusion of radiofrequency, or varicose veins surgery.Over 100 healthcare experts, including 50 specialty specialists, are dedicated to setting a new standard in healthcare services with the single-minded goal of providing uncomplicated quality healthcare."
"Yashoda Hospital, Secunderabad, Hyderabad","Multi-Superspeciality","https://www.indicure.com/assets/img/2022/02/Yashoda-Hospital-Secunderabad.jpg.webp","Hyderabad","Yashoda group of hospitals is one of the most revered names for quality healthcare not only in Hyderabad but in entire India. The group has evolved as a centre of excellence in medicine providing the highest quality standards to patients from across the world."
"Aster CMI Hospital, Hebbal, Bangalore","Multi-Superspeciality","https://www.indicure.com/assets/img/2022/02/Aster-CMI-360x223.jpg.webp","Bangalore","Aster CMI Bangalore is the first hospital by Aster DM, a healthcare enterprise spread across 280 establishments in 9 countries. Headquartered in Dubai, the network has around 14,000 employees, 1000 doctors, and several JCI accredited hospitals and clinics.The hospital is known for its serene ambiance, spacious interiors, advanced medical facilities, well-qualified doctors, and has always strived to achieve the best clinical outcomes. The hospital has secured its position as one of the best multispecialty hospitals in Bangalore as per the Times of India (TOI) All India Multispecialty Ranking Survey."
"Apollo Spectra Hospital, Chembur, Mumbai","Multi-Speciality","https://www.indicure.com/assets/img/best-hospitals/Mumbai/Apollo-Spectra-Hospital,-Chembur.jpg.webp","Mumbai","Apollo Spectra is a state-of-the-art specialty hospital. It is dedicated to bringing together excellent medical services and the finest healthcare management techniques. Bariatric Surgery, ENT specialties including Thyroid Surgery, General & Laparoscopic Surgery, Orthopedics & Spine surgery, Urology, and Varicose Veins, to name a few, are among the surgical specialties offered at the hospital.The hospital has 4 ultra-modern modular OTs, a state-of-the-art rehabilitation centre, an in-house pharmacy, and a waiting lounge for in-patients' families, to mention a few amenities. Over 125 healthcare experts, including 90 specialty specialists, are dedicated to setting a new standard in healthcare services with the single-minded goal of providing uncomplicated quality healthcare.The best part is the personalized services and care one can expect at the hospital, dedicated only to clean and elective surgeries, making it one of the most unique and best hospitals in Mumbai."
"Manipal Hospital, Jayanagar","Multi-Speciality","https://www.indicure.com/assets/img/best-hospitals/Bangalore/Manipal-Hospital-Jayanagar.jpg.webp","Bangalore","The renowned Dr. Ranjan Pai founded Manipal Hospital in Jayanagar in 1991. It is one of Manipal Hospitals' recognised units, located in the heart of South Bangalore.The hospital group has won various honors, including The Week Magazine's Best Hospital in Bangalore for the previous eight years, as well as being placed among the top five hospitals in the "INDIA'S MOST CARING HOSPITALS" poll and the prestigious Golden Peacock National Quality Award in 2005."
