HospitalName,Speciality,HospitalImage,Location,Description
"Apollo Hospital, Navi Mumbai","Multi-Superspeciality","https://www.indicure.com/assets/img/2022/02/Apollo-Hospitals-Mumbai.jpg.webp","Mumbai","Apollo Hospital, Navi Mumbai is the newest addition to the Apollo group having started its operations in 2016. It is a 500 bedded super-specialty tertiary care facility catering to Navi Mumbai and various suburbs of Mumbai.It is one of the most advanced multi-specialty tertiary care hospitals in the city, providing a wide range of treatments all under one roof. This is the Apollo Group's 66th hospital, which has been accredited by the National Accreditation Board for Hospitals (NABH) and Joint Commission International (JCI). It is equipped with cutting-edge technology and meets international standards making it one of the best hospital in Mumbai."
"Gleneagles Global Hospital, Mumbai","Multi-Superspeciality","https://www.indicure.com/assets/img/2022/02/Global-Hospitals-Mumbai.jpg.webp","Mumbai","Gleneagles Global hospital in Mumbai, which is the latest addition to the geographical footprints of the Gleneagles group in India, offers comprehensive cardiac care to its patients.With a track record of nearly 4000 cardiac procedures, the cardiac centre of excellence proudly stands as one of India's premier cardiac centres, specializing in cardiology and cardiovascular thoracic surgeries. Whether it is minimally invasive techniques or the most intricate heart transplant surgeries, the hospital possesses the necessary infrastructure and proficiency to handle them all.Equipped with state-of-the-art surgical suites, post-surgery intensive care units, and advanced diagnostic facilities, the hospital has established itself as a top destination for heart health in Mumbai."
"BLK Max Super Speciality Hospital","Multi Superspeciality","https://www.indicure.com/assets/img/2022/02/BLK-Max-Superspecialty-Hospital.jpg.webp","New Delhi","BL Kapur Memorial Hospital was one of the biggest standalone private hospitals in Delhi, NCR, now taken over by Max Group of hospitals. Established by late Dr. B L Kapur, an eminent Obstetrician, and Gynecologist on invitation by then Prime Minister of India, Mr. Jawahar Lal Nehru. The institute went on to become one of Delhi's premier multi-specialty hospitals. BLK Max Hospital has consistently ranked among the Top 10 Multi Super Speciality Hospitals in India.Accredited by JCI, USA, the institute has 650 beds with dedicated 125 critical care beds and over 150 specialties making it one of the best hospitals in New Delhi and India. Equipped with the most advanced technology, BLK is well renowned for Bone Marrow Transplants and other highly specialized treatments like Heart transplant."
"Fortis Hospital, Mulund, Mumbai","Multi-Superspeciality","https://www.indicure.com/assets/img/2022/02/Fortis-Hospital-Mulund-Mumbai.jpg.webp","Mumbai","Fortis Hospital, Mulund is a 300 bedded multispeciality tertiary care facility situated in the centre of the city, offering a range of clinical, diagnostic, and surgical services.The hospital began operations in 2002 and since then has achieved various milestones. The hospital is a JCI and NABH accredited facility and among very few hospitals to have NABH accreditation for Blood bank and NABL for Pathology Laboratory."
"Artemis Hospital, Gurgaon","Multi-Superspeciality","https://www.indicure.com/assets/img/2022/02/Artemis-Health-Institute-360x223.jpg.webp","Gurgaon","Artemis Health Institute is an initiative by the owners of Apollo Tyres into healthcare. Spread over 9 acres, Artemis is a 300 bedded multi-super specialty tertiary care hospital located at Gurgaon, in the National Capital Region, Delhi. Artemis was the first hospital in Haryana to get NABH accreditation within 3 years of its start-up. The hospital then added another feather in its cap in a few years of its startup- Artemis got the gold standard in healthcare accreditation – JCI, USA accreditation and became the first and only hospital in Gurgaon to be accredited by Joint Commission International (JCI, USA) in 2013.Besides having a robust infrastructure, Artemis hospital offers the most modern techniques for treatment and the most advanced surgical procedures."
"Wockhardt Hospital, Mumbai","Multi-Superspeciality","https://www.indicure.com/assets/img/2022/02/Wockhardt-Hospitals-360x223.jpg.webp","Mumbai","Wockhardt Hospitals is the hospital branch of the leading Wockhardt pharmaceutical company in India. The company is more than 4 decades old and is present in more than 20 countries around the globe. Wockhardt has 9 facilities in India in Mumbai, Nagpur, Rajkot, Nasik, and Surat.Wockhardt Hospital, South Mumbai is one of the most famous and advanced facilities of the Wockhardt group. Accredited by JCI, NABH and NABL, Wockhardt hospital, South Mumbai is a tertiary care multi super-specialty hospital offering state-of-the-art facilities and international standards of care.In pursuance of its vision to establish state-of-the-art medical facilities in India along with a high degree of clinical excellence, the hospital has entered into strategic alliances with Partners Medical International, USA, whereby Wockhardt has access to Harvard's expertise and experience in the fields of surgery and other Medicare services, making it one of the best hospitals in Mumbai."
"Fortis Memorial Research Institute, Gurgaon","Multi-Superspeciality","https://www.indicure.com/assets/img/2022/01/Fortis-Memorial-Research-Institute-360x223.jpg.webp","Gurgaon","Fortis Memorial Research Institute (FMRI), the flagship hospital of Fortis Healthcare, is a multi-specialty, quaternary care hospital and is counted among not only the best hospitals in New Delhi, but also one of the best hospitals in India and the world.The hospital is located in Gurgaon or NCR (National Capital Region), on the outskirts of Delhi. Besides being a premium referral healthcare facility, it endeavors to be the 'Mecca of Healthcare' for the Asia Pacific and beyond.The hospital is set on a spacious 11 acres campus, with 1000 beds, is equipped with state-of-the-art technology. FMRI is the first to bring the most advanced technology not only in India or Asia, but few are the first to be introduced in the world."
"Sir HN Reliance Hospital, Mumbai","Multi-Superspeciality","https://www.indicure.com/assets/img/best-hospitals/Mumbai/Sir-HN-Reliance-Foundation-Hospital,-Mumbai.jpg.webp","Mumbai","Sir HN Reliance Foundation Hospital was founded in 1925 and is Mumbai's largest LEED Gold-rated Green Hospital. It is Mumbai's first hospital to offer self-contained rooms, with an area of 800,000 square feet (showers, toilets and rest areas for relatives). The hospital features a whole level dedicated to in-patient beds that are free or heavily subsidized.The hospital adheres to AIA design standards, NFPA medical gas standards, ASHARE HVAC requirements, AERB Radiation and Nuclear Medicine standards, and Drug Controller of India blood bank standards."
"Batra Hospital & Medical Research Centre, New Delhi","Multi-Superspeciality","https://www.indicure.com/assets/img/best-hospitals/Delhi/Batra-Hospital-_-Medical-Research-Centre,-New-Delhi.jpg.webp","New Delhi","Batra Hospital is a well-known multispecialty hospital in Delhi. It is Delhi's first private multi-specialty hospital, having been founded in 1987 by the Ch. Aishi Ram Batra Public Charitable Trust. It was opened by the late Shri Rajiv Gandhi, India's Prime Minister at the time.The Neurology, Urology, Ophthalmology, Gastrointestinal, Orthopedic, and Pediatric Surgery Operation Theatre Complex contains seven technologically advanced Operation Theatres. The hospital includes four state-of-the-art Cardiac Surgery Theatres equipped with Trans Esophageal Echocardiography and other Intensive Monitoring equipment to give high-quality care to patients of all ages, from newborns to the elderly. A 64-slice CT scanner has been installed to assess the heart, kidneys, lungs, brain, coronaries, peripheral blood vessels, and all other body organs.Batra Hospital & Medical Research Centre pledges to serve its patients with efficient, effective, timely, and user-friendly healthcare using the best Medicare practices in a clean, healthy and revitalizing environment."
"Gleneagles Global Health City, Perumbakkam, Chennai","Multi-Superspeciality","https://www.indicure.com/assets/img/2022/02/Global-Hospitals-Chennai.jpg.webp","Chennai","Global Health City, Chennai is the flagship and largest hospital of Gleneagles hospitals in India. Spread over 21 acres, the hospital has over 1000 beds and has accreditations from many international agencies.The hospital is a super-specialty quaternary care facility, offering best-in-class services using cutting-edge technology and highly skilled and experienced healthcare professionals. The hospital attracts a lot of international patients and is most famous and renowned for kidney and liver transplants in India."
"Pushpawati Singhania Research Institute, New Delhi","Multi-Superspeciality","https://www.indicure.com/assets/img/best-hospitals/Delhi/Pushpawati-Singhania-Research-Institute,-New-Delhi.jpg.webp","New Delhi","Pushpawati Singhania Research Institute was founded in 1996 and is a NABL and NABH accredited hospital. It is considered India's best gastroenterology hospital. It is the earliest and most prestigious institute in South Asia and India for medical and surgical treatment of digestive problems. The JK Group, one of the country's most powerful industrial conglomerates, is behind it. The hospital is thus recognized as one of the best hospitals in New Delhi for its unique offerings.Gastroenterology, Nephrology, Urology, Gastro-Surgery, Kidney Transplantation, and diseases of the Liver, Kidney, Gallbladder, Pancreas, and Gastro-Intestinal Tract system are among the core specialties. General Medicine, Geriatrics, Diabetics, Endocrinology, Pediatric Gastroenterology, Critical Care, Gynecology, ENT, Cancer Treatment, Hepatobiliary Surgery, Nutrition and Dietetics, Chest Diseases, Eye Diseases, Pain Clinic, and Stoma Clinic are among the services provided."
"Apollo Hospital, Hyderguda, Hyderabad","Multi-Superspeciality","https://www.indicure.com/assets/img/best-hospitals/Hyderabad/Apollo-Hospital,-Hyderguda.jpg.webp","Hyderabad","Apollo Hospital, Hyderguda is a multi-specialty hospital that opened in Hyderguda in 2011. It's one of Hyderabad's most technologically advanced hospitals.Cosmetic surgery, bariatric surgery, diabetology, neurology and neurosurgery, gastrointestinal, urology, uncontrolled diabetes, preventive medicine, cardiology, endocrinology, orthopedics, and ENT are among the specialties and subspecialties offered by the hospital, which has over 30 departments.Since 2017, the hospital has been doing primary and revision total knee replacement surgeries in accordance with National Pharmaceutical Pricing Authority (NPPA) rules issued by the Government of India in an order dated August 16, 2017. Also, starting on April 1, 2019, Apollo Hospitals has a new management structure."
"Krishna Institute of Medical Sciences, Secunderabad, Hyderabad","Multi-Superspeciality","https://www.indicure.com/assets/img/2022/02/KIMS-Hospital-Kondapur-Hyderabad.jpg.webp","Hyderabad","KIMS Hospitals are one of the largest corporate Hospitals group in South India with over 2000 beds spread across 6 locations in the states of Telangana and Andhra Pradesh. The flagship and the largest hospital is in Secunderabad, which is a 1000 bedded hospital, ISO, NABH, NABL, and NABCB accredited assuring the best quality of healthcare services.KIMS is one of the first hospitals in Southern India to install 4-Arm HD da Vinci Robot technology. The hospital has received the Association of Healthcare Providers (India) ("AHPI") award for nursing excellence in 2016 and was ranked number one multi-specialty hospital in Hyderabad by the Times of India Survey in 2015. KIMS was the first hospital in Andhra Pradesh and Telangana to have been Green OT certified in 2015."
"SIMS Hospital, Chennai","Multi-Superspeciality","https://www.indicure.com/assets/img/best-hospitals/Chennai/SIMS-Hospital,-Vadapalani,-Chennai.jpg.webp","Chennai","SIMS Hospital in Chennai is equipped with a variety of technology and resources, and is managed by a team of compassionate super specialists who provide holistic care with the help of nurses, paramedical staff, and health care workers. SIMS Healthcare's facilities are built and equipped to satisfy the demanding needs of both domestic and international patients."
"Sri Ramachandra Medical Centre, Chennai","Multi-Superspeciality","https://www.indicure.com/assets/img/2022/02/Sri-Ramachandra-Medical-Centre-Chennai.jpg.webp","Chennai","Sri Ramachandra Medical Centre is a highly reputed medical institution not only in India but the Asia Pacific and beyond. Accredited by JCI, NABH, NABL, ISO, AABB ( American Association of Blood Banks ), and many others, the hospital offers the highest level of medical care and excellence in the field of patient services. Founded as a teaching hospital of Sri Ramachandra Medical College and Research Institute in 1985, by Late NPV Ramaswamy Udayar, the hospital offers all medical specialties under one roof.Sri Ramachandra Medical Centre is the first and only hospital affiliated with a medical university in India that has the privilege of JCI, NABH, NABL, and AABB accreditations. The hospital has 800 beds and 200 Intensive care units, provides healthcare treatment for over 35,000 inpatients and 2,50,000 outpatients every year."
"Fortis Hospital, Vadapalani, Chennai","Multi-Superspeciality","https://www.indicure.com/assets/img/best-hospitals/Chennai/Fortis-Hospital,-Vadapalani.jpg.webp","Chennai","The Fortis Hospital in Vadapalani is the company's second hospital in Chennai. Thiru Edappadi K. Palaniswami, the Chief Minister of Tamil Nadu, opened the super-specialty, quaternary care hospital in 2020. The hospital has a reputation for providing economical healthcare in a short amount of time, thanks to its cutting-edge infrastructure and highly experienced medical staff.The hospital is located on Arcot Road in Vadapalani, which is an excellent location.The Fortis Hospital in Vadapalani is a 250-bed super-specialty hospital with a 1.5-lakh-square-foot footprint. The hospital is housed in a nine-story structure built to allow simple patient access. It has 75 intensive care units (ICUs), six operating rooms, three minor operating rooms, and procedural rooms. It also contains emergency and casualty beds, as well as a cutting-edge cath lab and other world-class amenities. The medical equipment at the hospital is highly sophisticated.The hospital also has a trauma centre that is open 24 hours a day, seven days a week, and provides world-class care."
"Yashoda Hospital, Secunderabad, Hyderabad","Multi-Superspeciality","https://www.indicure.com/assets/img/2022/02/Yashoda-Hospital-Secunderabad.jpg.webp","Hyderabad","Yashoda group of hospitals is one of the most revered names for quality healthcare not only in Hyderabad but in entire India. The group has evolved as a centre of excellence in medicine providing the highest quality standards to patients from across the world."
