HospitalName,Speciality,HospitalImage,Location,Description
"Gleneagles Global Hospital, Mumbai","Multi-Superspeciality","https://www.indicure.com/assets/img/2022/02/Global-Hospitals-Mumbai.jpg.webp","Mumbai","Gleneagles Global hospital in Mumbai, which is the latest addition to the geographical footprints of the Gleneagles group in India, offers comprehensive cardiac care to its patients.With a track record of nearly 4000 cardiac procedures, the cardiac centre of excellence proudly stands as one of India's premier cardiac centres, specializing in cardiology and cardiovascular thoracic surgeries. Whether it is minimally invasive techniques or the most intricate heart transplant surgeries, the hospital possesses the necessary infrastructure and proficiency to handle them all.Equipped with state-of-the-art surgical suites, post-surgery intensive care units, and advanced diagnostic facilities, the hospital has established itself as a top destination for heart health in Mumbai."
"Apollo Hospital, Sheshadripuram, Bangalore","Multi-Superspeciality","https://www.indicure.com/assets/img/best-hospitals/Bangalore/Apollo-Hospital,-Sheshadripuram.jpg.webp","Bangalore","Sheshadripuram's Apollo Hospital is a multi-specialty hospital that first opened its doors to the public in 2015. It was the third hospital in Bangalore and the fourth in the state of Karnataka. The hospital has been offering outstanding service from its inception, in keeping with the group's concept.The Joint Commission International has accredited the hospital.Emergency and trauma care, cardiology, limited access cardiology, pediatric cardiology, neurosciences, gastro sciences, nephrology & renal transplant, and urology are among the specialties offered at Apollo Hospital, Sheshadripuram. It also features two centres specialized to the treatment of heart failure, as well as mobility problems, epilepsy care, and surgery.The Apollo Hospital in Sheshadripuram is equipped with the most up-to-date medical technology and provides the most up-to-date medical treatment. It includes a 200-bed capacity, a 10-bed state-of-the-art emergency department, and a 40-bed intensive care unit."
"Wockhardt Hospital, Mumbai","Multi-Superspeciality","https://www.indicure.com/assets/img/2022/02/Wockhardt-Hospitals-360x223.jpg.webp","Mumbai","Wockhardt Hospitals is the hospital branch of the leading Wockhardt pharmaceutical company in India. The company is more than 4 decades old and is present in more than 20 countries around the globe. Wockhardt has 9 facilities in India in Mumbai, Nagpur, Rajkot, Nasik, and Surat.Wockhardt Hospital, South Mumbai is one of the most famous and advanced facilities of the Wockhardt group. Accredited by JCI, NABH and NABL, Wockhardt hospital, South Mumbai is a tertiary care multi super-specialty hospital offering state-of-the-art facilities and international standards of care.In pursuance of its vision to establish state-of-the-art medical facilities in India along with a high degree of clinical excellence, the hospital has entered into strategic alliances with Partners Medical International, USA, whereby Wockhardt has access to Harvard's expertise and experience in the fields of surgery and other Medicare services, making it one of the best hospitals in Mumbai."
"Pushpawati Singhania Research Institute, New Delhi","Multi-Superspeciality","https://www.indicure.com/assets/img/best-hospitals/Delhi/Pushpawati-Singhania-Research-Institute,-New-Delhi.jpg.webp","New Delhi","Pushpawati Singhania Research Institute was founded in 1996 and is a NABL and NABH accredited hospital. It is considered India's best gastroenterology hospital. It is the earliest and most prestigious institute in South Asia and India for medical and surgical treatment of digestive problems. The JK Group, one of the country's most powerful industrial conglomerates, is behind it. The hospital is thus recognized as one of the best hospitals in New Delhi for its unique offerings.Gastroenterology, Nephrology, Urology, Gastro-Surgery, Kidney Transplantation, and diseases of the Liver, Kidney, Gallbladder, Pancreas, and Gastro-Intestinal Tract system are among the core specialties. General Medicine, Geriatrics, Diabetics, Endocrinology, Pediatric Gastroenterology, Critical Care, Gynecology, ENT, Cancer Treatment, Hepatobiliary Surgery, Nutrition and Dietetics, Chest Diseases, Eye Diseases, Pain Clinic, and Stoma Clinic are among the services provided."
"Fortis Hospital, Noida","Multi-Superspeciality","https://www.indicure.com/assets/img/2022/02/Fortis-Hospital-Noida.jpg.webp","Delhi (NCR)","The NABH accredited hospital of Fortis group in Noida was started in 2004 and is the only Fortis Escorts' Heart Command Centre in the entire UP. It is the only corporate facility in the area that offers a full range of services, from diagnostics to organ transplantation (kidney transplant and liver transplant).Cardiac, Neurological, Gastroenterological, and Renal Joint Therapeutic Services are available. The Cardiac Centre of Excellence at Fortis Noida has earned a great reputation because of its exceptional team and the results even in the most complex cardiac cases.Renal Science and Liver Transplant have also risen to become the most important referral centres."
"Manipal Hospital, Palam Vihar, Gurgaon","Multi-Superspeciality","https://www.indicure.com/assets/img/2022/02/Manipal-Hospital-Formerly-Columbia-Asia-Palam-Vihar-Gurgaon.jpg.webp","Gurgaon","Manipal Hospital, formerly Columbia Asia, Palam Vihar is a 90 bedded, NABH accredited multi-specialty facility located in upmarket Palam Vihar in NCR Delhi, located in close vicinity to the airport. The hospital has an international level infrastructure and adheres to globally benchmarked medical, nursing, and operating practices. It is one of Gurgaon's most popular healthcare service providers.Obstetrics & Gynecology, Internal Medicine, General Surgery, Paediatrics, Ophthalmology, Ear, Nose & Throat, Urology, Gastroenterology, Plastic Surgery Orthopaedics, Dermatology, Smoking Session Clinic, Sleep Lab, Cardiology, Neurosurgery & Spine Surgery, Pulmonology are some of the clinical services available at the hospital."
"Max Super Speciality Hospital, Gurgaon","Multi-Superspeciality","https://www.indicure.com/assets/img/2022/02/Max-Super-Specialty-Hospital-Gurgaon.jpg.webp","Gurgaon","Max Healthcare first opened its doors in 2001. Max Super Specialty Hospital in Gurgaon, which received the Express Healthcare Awards for Excellence in Healthcare in 2007, is a multi-specialty, tertiary care facility that offers centres of excellence in Gastroenterology, IVF, Aesthetic & Reconstructive Surgery, Pulmonology, Cardiac Surgery (CTVS), Endocrinology & Endocrine Surgery, Nephrology, Neurosciences, Internal Medicine, and Obstetrics.The hospital has prestigious NABH accreditation and NABL accreditation for its laboratories."
"Fortis Hospital, Nagarbhavi, Bangalore","Multi-Superspeciality","https://www.indicure.com/assets/img/best-hospitals/Bangalore/Fortis Hospital.jpg.webp","Bangalore","The Fortis Hospital in Nagarbhavi, which opened its doors in 2003, is NABH recognized facility. It has obtained the prestigious Economic Times Health World Hospital Award as one of the finest hospitals for Cardiac care for adults and children.Fortis is the most trusted healthcare network in the world. They provide a comprehensive range of integrated healthcare services, including clinics, quaternary care facilities, and a variety of ancillary services.The team consists of highly-trained specialists as well as competent and experienced personnel. The hospital is well-equipped with the most up-to-date treatment options. In addition to cardiology, the team skillfully handles orthopedics, liver care, gastroenterology, and urological issues."
"Apollo Hospital, DRDO, Hyderabad","Multi-Superspeciality","https://www.indicure.com/assets/img/best-hospitals/Hyderabad/Apollo-Hospital-DRDO.jpg.webp","Hyderabad","Apollo Hospital DRDO, Kanchan Bagh is a multi-specialty hospital in Hyderabad that uses technological innovation, research, and quality expertise to deliver integrated world-class healthcare to everyone.Heart, Cancer Care, Critical Care, Gastroenterology, Orthopedics, Neurosciences, and Emergency are among the hospital's seven centres of excellence. In addition, it has Departments like Dental, Obstetrics & Gynecology, Pediatrics, Nephrology & Urology, and Plastic and Cosmetic Surgery.The Orthopedic Department is one of the best in Hyderabad, with a state-of-the-art operating room dedicated solely to orthopedic procedures. This is bolstered by a fully equipped Physiotherapy Unit, which provides crucial rehabilitation assistance.It takes pride in its Cardiology Department, which provides cardiac care on par with that provided in the United States and Europe. In reality, Cardio-thoracic surgery in Heart Surgery and DORR Procedure (Left Ventricular Reconstruction) has a 99 percent success rate.It offers 'Apollo Prism' feature that allows simple access to an individual's health information and test results from any Apollo Hospitals with a single click."
"Fortis Hospital, Cunningham Road, Bangalore","Multi-Superspeciality","https://www.indicure.com/assets/img/best-hospitals/Bangalore/Fortis-Hospital,-Cunningham-Road.jpg.webp","Bangalore","The Fortis Hospital, Bangalore (Cunningham Road) is a large medical institution headquartered in Bangalore, Karnataka, founded in the year 1990.Fortis Hospital on Cunningham Road has established itself as one of the state's and country's most prestigious medical institutions. Without a doubt, this hospital has solidified its status as one of the best-equipped super-specialty private hospitals in the country over the last 25 years.The hospital has a capacity of 150 beds and is known for being one of the best in cardiac treatment and diagnosis. The hospital is known for its interventional cardiology and cardiac surgery centres of excellence.Urology, orthopedics, digestive care, emergency care, and critical care are among the hospital's sophisticated super-specialized services. The hospital has modern navigation, surgical, and monitoring systems, as well as state-of-the-art central sterile goods supply (CSSD) systems. The hospital conducts internal audits every six months to assess the efficiency of the quality management system."
"Venkateshwar Hospital, New Delhi","Multi-Superspeciality","https://www.indicure.com/assets/img/2022/03/Venkateshwar-Hospital-New-Delhi.jpg.webp","New Delhi","Venkateshwar Hospital was founded by the Venkateshwara Group in New Delhi. It is the first hospital in India to be supplied with Paramount Japan's world-class furniture and other equipment.Cardio-Thoracic & Vascular Surgery, Dental, Gastroenterology & Hepatology, Gastrointestinal, Minimal Access Surgery & Liver Transplant, Interventional Cardiology, Medical Oncology & Bone Marrow Transplant, Neurology & Pediatric Neurology, Neurosurgery, Orthopedics & Joint Replacement, Radiation Oncology, Surgical & Gynae Oncology, Pulmonology & Sleep Medicine are some of the key specialties the hospital offers."
"Batra Hospital & Medical Research Centre, New Delhi","Multi-Superspeciality","https://www.indicure.com/assets/img/best-hospitals/Delhi/Batra-Hospital-_-Medical-Research-Centre,-New-Delhi.jpg.webp","New Delhi","Batra Hospital is a well-known multispecialty hospital in Delhi. It is Delhi's first private multi-specialty hospital, having been founded in 1987 by the Ch. Aishi Ram Batra Public Charitable Trust. It was opened by the late Shri Rajiv Gandhi, India's Prime Minister at the time.The Neurology, Urology, Ophthalmology, Gastrointestinal, Orthopedic, and Pediatric Surgery Operation Theatre Complex contains seven technologically advanced Operation Theatres. The hospital includes four state-of-the-art Cardiac Surgery Theatres equipped with Trans Esophageal Echocardiography and other Intensive Monitoring equipment to give high-quality care to patients of all ages, from newborns to the elderly. A 64-slice CT scanner has been installed to assess the heart, kidneys, lungs, brain, coronaries, peripheral blood vessels, and all other body organs.Batra Hospital & Medical Research Centre pledges to serve its patients with efficient, effective, timely, and user-friendly healthcare using the best Medicare practices in a clean, healthy and revitalizing environment."
"Care Hospitals, Banjara Hills","Multi-Superspeciality","https://www.indicure.com/assets/img/best-hospitals/Hyderabad/Care-Hospitals,-Banjara-Hills,-Hyderabad.jpg.webp","Hyderabad","The CARE Hospitals Group is a multispecialty healthcare provider, with 14 hospitals serving 6 cities across 5 states of India. The group's flagship CARE Hospitals, located in the poshest Banjara Hills in Hyderabad was set up in 2000. The hospital has grown to be one of the most renowned and best hospitals in Hyderabad in a span of fewer than two decades.This NABH and NABL-accredited hospital has 435 beds and serves 1,80,000 outpatients and 16,000 in-patients per year. It has the world's first dual-source, 128-slice CT scanner, which is also the first of its kind in South India.More than 5000 non-cardiac and 1700 cardiothoracic procedures are conducted each year. Every year, modern cath laboratories do around 4000 cardiac procedures."
"Primus Super Speciality Hospital, New Delhi","Multi-Superspeciality","https://www.indicure.com/assets/img/best-hospitals/Delhi/Primus-Super-Speciality-Hospital,-New-Delhi.jpg.webp","New Delhi","Primus Super Specialty Hospital is a NABH accredited hospital that performs more than 3000 procedures per year and serves over 45,000 patients in the outpatient department.Orthopedics, Brain and Spine Surgery and Rehabilitation, IVF Procedures, Gastroenterology, ENT procedures, Cochlear Implants, and Nephrology are some of his areas of expertise. The hospital has conducted the most joint replacements for arthritic patients in North India making it one of the best hospitals in New Delhi.It is India's first facility to execute a Binaural Cochlear Implant."
"Sharda Hospital, Noida, Delhi","Multi-Superspeciality","https://www.indicure.com/assets/img/best-hospitals/Delhi/Sharda-Hospital,-Noida.jpg.webp","Delhi (NCR)","Sharda Hospital, part of the Sharda Education and Healthcare Group, is a well-known hospital in Greater Noida, Delhi, NCR. It is one of the largest super-specialty hospitals in the world, providing medical care that is on par with international standards.Since its inception in 2005, the devoted team of doctors has performed over 100,000 procedures and 300,000 IPD hospitalizations. It's a 900-bed hospital with critical care units such ICCU, CTVS, ICU, MICU, and SICU, as well as causality and trauma units.Cardiology, cardiothoracic surgery, neurosciences, joint replacement, spine surgery, orthopedics, urology, nephrology, advanced ophthalmological and dental operations, including maxillofacial and craniofacial procedures, and gastrointestinal are among the services offered.For transmission, Sharda hospital makes use of some of the most current medical technology, such as telemedicine and teleradiology (for transmitting radiological images such as CT, MRI scans, and X-rays from one site to another for study purposes), telepathology, and tele-ICU.Sharda hospital has also built a 'Panchakarma Centre' to deliver massage therapies of high and positive prognostic value to ailments that are regarded medically unmanageable, in response to rising demand and popularity of Ayurveda."
"Metro Hospital, Faridabad, New Delhi","Multi-Superspeciality","https://www.indicure.com/assets/img/best-hospitals/Delhi/Metro-Hospital,-Faridabad.jpg.webp","New Delhi (NCR)","Since 2002, Metro Hospital in Faridabad has served as Haryana's first dedicated heart hospital, 'offering international grade health treatment at an accessible cost to the populace.'The multispecialty hospital is designed to provide the highest levels of professional expertise and world-class care in all major disciplines of cardiology, neurology, orthopedics, oncology, and all support specialties such as bariatric and minimally invasive surgery, internal medicine, general surgery, urology, nephrology, gastroenterology, rehabilitative services, and pulmonology, among others.The hospital is spread across 8 acres of land in the heart of the city, has 400 beds and will be expanded in the near future. The Metro Hospital is one of the region's largest tertiary centres, routinely ranking among the top multispecialty hospitals in Delhi-NCR."
